{
  "chapters" : [
    {
      "endWordIndex" : 376,
      "footnotes" : [

      ],
      "htmlContent" : "<p>Provided proper attribution is provided, Google hereby grants permission to reproduce the tables and figures in this paper solely for use in journalistic or scholarly works.<\/p><p>Attention Is All You Need<\/p><p>arXiv:1706.03762v7 [cs.CL] 2 Aug 2023<\/p><p>Ashish Vaswani∗Noam Shazeer∗Niki Parmar∗Jakob Uszkoreit∗ Google Brain<\/p><p>Google BrainGoogle ResearchGoogle Research avaswani@google.comnoam@google.comnikip@google.comusz@google.com Llion Jones∗ Aidan N. Gomez∗† Łukasz Kaiser∗ Google ResearchUniversity of Toronto Google Brain lukaszkaiser@google.comllion@google.comaidan@cs.toronto.edu Illia Polosukhin∗‡ illia.polosukhin@gmail.com<\/p><p>Abstract<\/p><p>The dominant sequence transduction models are based on complex recurrent or convolutional neural networks that include an encoder and a decoder. The best performing models also connect the encoder and decoder through an attention mechanism. We propose a new simple network architecture, the Transformer, based solely on attention mechanisms, dispensing with recurrence and convolutions entirely. Experiments on two machine translation tasks show these models to be superior in quality while being more parallelizable and requiring significantly less time to train. Our model achieves 28.4 BLEU on the WMT 2014 Englishto-German translation task, improving over the existing best results, including ensembles, by over 2 BLEU. On the WMT 2014 English-to-French translation task, our model establishes a new single-model state-of-the-art BLEU score of 41.8 after training for 3.5 days on eight GPUs, a small fraction of the training costs of the best models from the literature. We show that the Transformer generalizes well to other tasks by applying it successfully to English constituency parsing both with large and limited training data.<\/p><p>∗Equal contribution. Listing order is random. Jakob proposed replacing RNNs with self-attention and started the effort to evaluate this idea. Ashish, with Illia, designed and implemented the first Transformer models and has been crucially involved in every aspect of this work. Noam proposed scaled dot-product attention, multi-head attention and the parameter-free position representation and became the other person involved in nearly every detail. Niki designed, implemented, tuned and evaluated countless model variants in our original codebase and tensor2tensor. Llion also experimented with novel model variants, was responsible for our initial codebase, and efficient inference and visualizations. Lukasz and Aidan spent countless long days designing various parts of and implementing tensor2tensor, replacing our earlier codebase, greatly improving results and massively accelerating our research. †Work performed while at Google Brain. ‡Work performed while at Google Research.<\/p>",
      "id" : "pdf-front-matter",
      "images" : [

      ],
      "level" : 0,
      "paragraphStarts" : [
        0,
        26,
        31,
        36,
        43,
        65,
        66,
        235
      ],
      "plainText" : "Provided proper attribution is provided, Google hereby grants permission to reproduce the tables and figures in this paper solely for use in journalistic or scholarly works.\n\nAttention Is All You Need\n\narXiv:1706.03762v7 [cs.CL] 2 Aug 2023\n\nAshish Vaswani∗Noam Shazeer∗Niki Parmar∗Jakob Uszkoreit∗ Google Brain\n\nGoogle BrainGoogle ResearchGoogle Research avaswani@google.comnoam@google.comnikip@google.comusz@google.com Llion Jones∗ Aidan N. Gomez∗† Łukasz Kaiser∗ Google ResearchUniversity of Toronto Google Brain lukaszkaiser@google.comllion@google.comaidan@cs.toronto.edu Illia Polosukhin∗‡ illia.polosukhin@gmail.com\n\nAbstract\n\nThe dominant sequence transduction models are based on complex recurrent or convolutional neural networks that include an encoder and a decoder. The best performing models also connect the encoder and decoder through an attention mechanism. We propose a new simple network architecture, the Transformer, based solely on attention mechanisms, dispensing with recurrence and convolutions entirely. Experiments on two machine translation tasks show these models to be superior in quality while being more parallelizable and requiring significantly less time to train. Our model achieves 28.4 BLEU on the WMT 2014 Englishto-German translation task, improving over the existing best results, including ensembles, by over 2 BLEU. On the WMT 2014 English-to-French translation task, our model establishes a new single-model state-of-the-art BLEU score of 41.8 after training for 3.5 days on eight GPUs, a small fraction of the training costs of the best models from the literature. We show that the Transformer generalizes well to other tasks by applying it successfully to English constituency parsing both with large and limited training data.\n\n∗Equal contribution. Listing order is random. Jakob proposed replacing RNNs with self-attention and started the effort to evaluate this idea. Ashish, with Illia, designed and implemented the first Transformer models and has been crucially involved in every aspect of this work. Noam proposed scaled dot-product attention, multi-head attention and the parameter-free position representation and became the other person involved in nearly every detail. Niki designed, implemented, tuned and evaluated countless model variants in our original codebase and tensor2tensor. Llion also experimented with novel model variants, was responsible for our initial codebase, and efficient inference and visualizations. Lukasz and Aidan spent countless long days designing various parts of and implementing tensor2tensor, replacing our earlier codebase, greatly improving results and massively accelerating our research. †Work performed while at Google Brain. ‡Work performed while at Google Research.",
      "startPage" : 1,
      "startWordIndex" : 0,
      "title" : "Front Matter",
      "tokens" : [
        "Provided",
        "proper",
        "attribution",
        "is",
        "provided,",
        "Google",
        "hereby",
        "grants",
        "permission",
        "to",
        "reproduce",
        "the",
        "tables",
        "and",
        "figures",
        "in",
        "this",
        "paper",
        "solely",
        "for",
        "use",
        "in",
        "journalistic",
        "or",
        "scholarly",
        "works.",
        "Attention",
        "Is",
        "All",
        "You",
        "Need",
        "arXiv:1706.03762v7",
        "[cs.CL]",
        "2",
        "Aug",
        "2023",
        "Ashish",
        "Vaswani∗Noam",
        "Shazeer∗Niki",
        "Parmar∗Jakob",
        "Uszkoreit∗",
        "Google",
        "Brain",
        "Google",
        "BrainGoogle",
        "ResearchGoogle",
        "Research",
        "avaswani@google.comnoam@google.comnikip@google.comusz@google.com",
        "Llion",
        "Jones∗",
        "Aidan",
        "N.",
        "Gomez∗†",
        "Łukasz",
        "Kaiser∗",
        "Google",
        "ResearchUniversity",
        "of",
        "Toronto",
        "Google",
        "Brain",
        "lukaszkaiser@google.comllion@google.comaidan@cs.toronto.edu",
        "Illia",
        "Polosukhin∗‡",
        "illia.polosukhin@gmail.com",
        "Abstract",
        "The",
        "dominant",
        "sequence",
        "transduction",
        "models",
        "are",
        "based",
        "on",
        "complex",
        "recurrent",
        "or",
        "convolutional",
        "neural",
        "networks",
        "that",
        "include",
        "an",
        "encoder",
        "and",
        "a",
        "decoder.",
        "The",
        "best",
        "performing",
        "models",
        "also",
        "connect",
        "the",
        "encoder",
        "and",
        "decoder",
        "through",
        "an",
        "attention",
        "mechanism.",
        "We",
        "propose",
        "a",
        "new",
        "simple",
        "network",
        "architecture,",
        "the",
        "Transformer,",
        "based",
        "solely",
        "on",
        "attention",
        "mechanisms,",
        "dispensing",
        "with",
        "recurrence",
        "and",
        "convolutions",
        "entirely.",
        "Experiments",
        "on",
        "two",
        "machine",
        "translation",
        "tasks",
        "show",
        "these",
        "models",
        "to",
        "be",
        "superior",
        "in",
        "quality",
        "while",
        "being",
        "more",
        "parallelizable",
        "and",
        "requiring",
        "significantly",
        "less",
        "time",
        "to",
        "train.",
        "Our",
        "model",
        "achieves",
        "28.4",
        "BLEU",
        "on",
        "the",
        "WMT",
        "2014",
        "Englishto-German",
        "translation",
        "task,",
        "improving",
        "over",
        "the",
        "existing",
        "best",
        "results,",
        "including",
        "ensembles,",
        "by",
        "over",
        "2",
        "BLEU.",
        "On",
        "the",
        "WMT",
        "2014",
        "English-to-French",
        "translation",
        "task,",
        "our",
        "model",
        "establishes",
        "a",
        "new",
        "single-model",
        "state-of-the-art",
        "BLEU",
        "score",
        "of",
        "41.8",
        "after",
        "training",
        "for",
        "3.5",
        "days",
        "on",
        "eight",
        "GPUs,",
        "a",
        "small",
        "fraction",
        "of",
        "the",
        "training",
        "costs",
        "of",
        "the",
        "best",
        "models",
        "from",
        "the",
        "literature.",
        "We",
        "show",
        "that",